Grid Dynamics Poland,QA Automation Engineer with Java/Big Data,11,mid,"AWS, Hadoop, Java, Testing",,full_time,hybrid,B2B,20000.0-26000.0,False,pomorskie,Gdańsk,aleja Grunwaldzka 472c,True,True,2025-02-24 16:01:42.627000+00:00
Experis Manpower Group,iOS Developer,10,mid,"Design Patterns, Objective-C, RESTful API, Swift, UI Kit, iOS, iOS frameworks",,full_time,remote,B2B,24000.0-25600.0,False,mazowieckie,Warszawa,.,False,True,2025-02-24 16:01:42.627000+00:00
Experis Manpower Group,Android Developer,10,mid,"Android, Android SDK, Design Patterns, Java, Kotlin, RESTful API",,full_time,hybrid,B2B,24000.0-25600.0,False,mazowieckie,Warszawa,.,False,True,2025-02-24 16:01:42.627000+00:00
SmartLunch,Mobilny Serwisant Automatów,21,mid,"Linux, Windows",,full_time,hybrid,Permanent,6000.0-7300.0,True,dolnośląskie,Wrocław,Kutnowska 1,False,False,2025-02-24 16:01:42.627000+00:00
Schenker Technology Center Warsaw,Cloud Engineer - AVD,24,senior,"Azure, Azure Services",,full_time,hybrid,B2B,16000.0-24000.0,False,mazowieckie,Warszawa,Żwirki i Wigury Street 16C,True,True,2025-02-24 16:01:42.627000+00:00
Juo,Full-stack Engineer,1,senior,"GraphQL, JS, REST, React, Rust, SQL, Shopify, Tailwind CSS, TypeScript, Vue",,full_time,remote,B2B,12000.0-20000.0,False,mazowieckie,Warszawa,Bracka,False,True,2025-02-24 16:01:42.627000+00:00
Kevin Edward,Principal DevOps,12,senior,"AWS, Ansible, Containers, Docker, ITIL, Kubernetes, Linux, Microsoft, Networking",,full_time,hybrid,B2B,20000.0-28000.0,False,mazowieckie,Warsaw,central Warsaw,True,True,2025-02-24 15:51:07.674000+00:00
GreenMinds Sp. z o.o.,AI & .Net - Fullstack Web Developer,25,mid,"ASP.NET, C#, DDD, MS Azure, Onion Architecture, TDD",,full_time,remote,B2B,21000.0-23000.0,False,mazowieckie,Warszawa,Konstruktorska 9,False,True,2025-02-24 15:50:00.666000+00:00
7N,Data Architect (low-code platform),19,mid,"ETL, Hadoop, Kafka, Low-code platform, MS SQL, MS SQL Server",,full_time,hybrid,B2B,23520.0-28560.0,False,mazowieckie,Warszawa,Centrum,False,True,2025-02-24 15:46:17.957000+00:00
7N,Konsultant - Wdrożeniowiec Microsoft Dynamics 365,13,mid,"BPMN, Microsoft Dynamics 365, Microsoft Dynamics AX, Power BI",,full_time,remote,B2B,25200.0-33600.0,False,mazowieckie,Warszawa,.,False,True,2025-02-24 15:43:41.747000+00:00
Harvey Nash Technology,Android Developer,10,senior,"Android, CI, Coroutines, Espresso, Jetpack Compose, Kotlin, REST API",,full_time,remote,B2B,20000.0-27000.0,False,mazowieckie,Warszawa,Centrum,True,True,2025-02-24 15:19:41.870000+00:00
Medpace,Senior Fullstack .NET Developer,7,senior,".Net, Angular, Azure, C#, Entity Framework, GitHub, JavaScript, SASS, SQL, SQL Server",,full_time,office,Permanent,16000.0-24000.0,True,mazowieckie,Warszawa,Żwirki i Wigury 16C,True,True,2025-02-24 15:14:57.244000+00:00
Harvey Nash Technology,"DevOps Engineer (AWS, Kubernetes, Terraform, scripting/coding)",12,senior,"AWS, DevOps, English, Kubernetes, Scripting, Terraform",,full_time,hybrid,Permanent,25000.0-35000.0,True,mazowieckie,Warszawa,Warsaw,False,True,2025-02-24 15:13:29.624000+00:00
Kintek,"Full-stack Developer (Node.js, Remix, React)",1,mid,"CSS, HTML5, JAVA SCRIPT, Node.js, Python, REST API, Remix, SQL, Swift, TypeScript",,full_time,remote,B2B,22000.0-30000.0,False,mazowieckie,Warszawa,Centrum,True,False,2025-02-24 15:07:54.080000+00:00
Graylight Imaging,Senior Machine Learning Engineer,25,senior,"Deep Learning, Keras Numpy, MLflow, OpenCV, Pandas, PyTorch, PyVista, Python, SciPy scikit-learn, TensorFlow",,full_time,remote,B2B,17300.0-27550.0,False,śląskie,Gliwice,,False,True,2025-02-24 15:00:43.064000+00:00
Graylight Imaging,Machine Learning Engineer,25,mid,"AI, Jupyter Notebook, MLflow, Machine Learning, NumPy, Pandas, PyTorch, Python, SciPy, TensorFlow",,full_time,remote,Permanent,9000.0-14600.0,True,śląskie,Gliwice,,False,True,2025-02-24 15:00:43.064000+00:00
7N,Python Engineer (pharma),5,senior,"Azure, CI/CD, English, Machine Learning, Pandas, Python, dash, poetry",,full_time,remote,B2B,23200.0-24800.0,False,łódzkie,Poland,remote 100%,False,True,2025-02-24 15:00:43.064000+00:00
A4BEE,R&D Network / DevOps Engineer,12,mid,"AWS, Ansible, Docker, GCP, Jenkins, MQTT, Mikrotik, Networks, Python, VPN",,full_time,office,B2B,7000.0-12000.0,False,dolnośląskie,Wrocław,Muchoborska 8,False,True,2025-02-24 15:00:43.064000+00:00
Kevin Edward,Android Developer,10,senior,"Amazon AWS, Android, C++, CI/CD, DevOps, JVM, Jenkins, Kotlin, Splunk",,full_time,remote,B2B,20000.0-33000.0,False,małopolskie,Kraków,Central Krakow,True,True,2025-02-24 15:00:43.064000+00:00
7N,Professional Python Engineer with Azure,5,mid,"Azure, CI/CD, DevOps, English, Python",,full_time,remote,B2B,21840.0-24000.0,False,łódzkie,Poland,remote 100%,False,True,2025-02-24 15:00:43.064000+00:00
Link Group,SAP Business Analyst,17,mid,"Business Analysis, English, SAP",,full_time,hybrid,B2B,18000.0-22000.0,False,mazowieckie,Warszawa,Al. Jerozolimskie 142 A,False,True,2025-02-24 15:00:43.064000+00:00
Beesafe,Data/ML Platform Tech Lead / Data Engineer,25,senior,"AI, Airflow, Azure, Kafka, Python, Scrum",,full_time,hybrid,B2B,23000.0-28000.0,False,mazowieckie,Warszawa,Al. Jerozolimskie 162,False,True,2025-02-24 15:00:43.064000+00:00
emagine Polska,Senior Fullstack Developer - Vue.js + AWS (Node.js or Python),1,senior,"AWS, DuckDB, English, Node.js, Python, Snowflake, TypeScript, Vue.js",,full_time,remote,B2B,31920.0-31920.0,False,mazowieckie,Warszawa,,False,False,2025-02-24 15:00:43.064000+00:00
emagine Polska,Senior Hadoop / Big Data Developer,19,senior,"CI/CD, Hive, Impala, Java, Linux Shell Scripting, SQL, Scala, Spark, Sqoop, Yarn",,full_time,hybrid,B2B,28560.0-28560.0,False,pomorskie,Gdynia,,False,False,2025-02-24 15:00:43.064000+00:00
7N,SAP BTP Cloud Developer,22,mid,"JavaScript, SAP BTP, SAP CAP Node, SAP Fiori",,full_time,remote,B2B,27720.0-31920.0,False,mazowieckie,Warszawa,Krakowiaków 46,False,True,2025-02-24 15:00:43.064000+00:00
Xebia sp. z o.o.,👉 Principal Frontend Developer,1,senior,"Next.js, React, TypeScript",,full_time,remote,B2B,22000.0-27000.0,False,dolnośląskie,Wrocław,Sucha 3,False,True,2025-02-24 15:00:43.064000+00:00
Britenet,Dynamics 365 F&O Consultant,22,mid,"Agile, D365 F&O, ERP",,full_time,remote,B2B,21840.0-28560.0,False,mazowieckie,Warszawa,centrum,False,True,2025-02-24 15:00:43.064000+00:00
"Solwit SA, Alten Polska",Network Engineer,11,mid,"ISO/OSI, Network, Python",,full_time,remote,B2B,14000.0-19000.0,False,pomorskie,Gdańsk,Azymutalna 11,False,True,2025-02-24 15:00:43.064000+00:00
Crestt,Haskell Developer (100% remote),24,mid,"C++, Git, Haskell",,full_time,remote,B2B,31920.0-40320.0,False,mazowieckie,Warszawa,Centrum,False,True,2025-02-24 15:00:43.064000+00:00
Grid Dynamics Poland,Senior ML Frameworks Engineer,5,senior,"Java, LLM, Machine Learning, Python, Scala",,full_time,hybrid,B2B,20000.0-26000.0,False,małopolskie,Kraków,al. 3 Maja 7,True,True,2025-02-24 15:00:43.064000+00:00
H2B Group,DevOps Warszawa,12,mid,"CI/CD, DevOps, Docker, English, Kubernetes, SQL",,full_time,hybrid,B2B,19200.0-20800.0,False,mazowieckie,Warszawa,Al. Jerozolimskie 100,False,True,2025-02-24 15:00:43.064000+00:00
Ramp Network,Data Analyst,19,mid,"Data, Google Cloud Platform, Power BI, SQL, Tableau",,full_time,hybrid,B2B,9000.0-11500.0,False,mazowieckie,Warszawa,,False,False,2025-02-24 15:00:43.064000+00:00
Xebia sp. z o.o.,👉 Java Developer,6,mid,"Azure, CI/CD, Java, Microservices",,full_time,hybrid,B2B,16500.0-25000.0,False,małopolskie,Kraków,Przy Rondzie,False,True,2025-02-24 15:00:43.064000+00:00
Experis Manpower Group,Power BI Developer,17,mid,"Azure DevOps, DAX Studio, English, Power BI, Power BI Desktop, Power BI Portal, Power BI Premium, Power BI embedded",,full_time,remote,B2B,23520.0-24360.0,False,mazowieckie,Warszawa,Warszawa,False,True,2025-02-24 15:00:43.064000+00:00
Affirm,"Analyst II, Strategic Insights",17,mid,"Looker, Python, R, SQL, Tableau",,full_time,remote,Permanent,15000.0-21750.0,True,mazowieckie,Warszawa,Koszykowa 61,True,True,2025-02-24 15:00:43.064000+00:00
Schenker Technology Center Warsaw,System Analyst,17,mid,"API, EDI",,full_time,hybrid,Permanent,12000.0-14500.0,True,mazowieckie,Warszawa,Żwirki i Wigury 16C,False,False,2025-02-24 15:00:43.064000+00:00
Jit Team,Senior .NET Engineer,7,senior,".Net, AWS, Amazon AWS, CI/CD, Kafka, SQL Server",,full_time,hybrid,B2B,24000.0-28000.0,False,pomorskie,Gdynia,.,False,False,2025-02-24 15:00:43.064000+00:00
Antal Sp. z o.o.,Senior Full stack Engineer,6,senior,"CI/CD, Java 8+, ReactJS",,full_time,hybrid,B2B,26880.0-31920.0,False,małopolskie,Kraków,centrum,False,False,2025-02-24 15:00:43.064000+00:00
eLeader Sp. z o.o.,DevOps Engineer,12,mid,"Bash, Docker, Jenkins, Kubernetes, Linux, OpenShift, Python",,full_time,office,B2B,18000.0-25000.0,False,lubelskie,Lublin,Nałęczowska 16,False,False,2025-02-24 15:00:43.064000+00:00
HSBC Service Delivery,Software Engineering Manager (Collateral IT) (Investment Banking Tech),6,senior,"Agile, DevOps, Google Cloud Platform, Java",,full_time,hybrid,Permanent,28000.0-33000.0,True,małopolskie,Kraków,Kapelanka 42a,False,False,2025-02-24 15:00:43.064000+00:00
AVSystem,Technical Product Manager,15,mid,"B2B Products, Reserach and analysis, SDLC, Software Architecture, Telco industry, product marketing",,full_time,hybrid,B2B,16000.0-22000.0,False,małopolskie,Kraków,Walerego Eljasza-Radzikowskiego 47d,False,False,2025-02-24 15:00:43.064000+00:00
P&P Solutions,Senior Android Developer,10,senior,"Android, Android SDK, Kotlin",,full_time,hybrid,B2B,16800.0-21000.0,False,małopolskie,Kraków,Kraków,False,True,2025-02-24 14:58:29.250000+00:00
Avenga,QA Engineer,5,senior,"BDD, Git, Jenkins, Python, SQL",,full_time,hybrid,B2B,23520.0-25200.0,False,mazowieckie,Warszawa,Centrum,False,True,2025-02-24 14:57:38.812000+00:00
gog.com,Product Engineering Team Lead,15,senior,"Manager, Team Leadership",,full_time,hybrid,B2B,20000.0-30000.0,False,mazowieckie,Warszawa,Jagiellońska 74,False,False,2025-02-24 14:40:42.551000+00:00
Jit Team,Java/ Kotlin Developer,6,senior,"Java, Kotlin",,full_time,hybrid,B2B,20000.0-24000.0,False,mazowieckie,Warszawa,.,False,False,2025-02-24 14:12:03.334000+00:00
Apollo.io,Engineering Manager,5,senior,"AI, Databricks, Elasticsearch, MongoDB, Project Management, Python, React, Ruby, SQL, Snowflake",,full_time,remote,Permanent,30000.0-52000.0,True,mazowieckie,Warszawa,,False,False,2025-02-24 14:06:53.273000+00:00
Avenga,Senior Java Developer,6,senior,"Docker, Java, Kafka, Kotlin, Kubernetes, REST API, Spring Boot",,full_time,hybrid,B2B,23520.0-26880.0,False,małopolskie,Kraków,Generała Bohdana Zielińskiego 22,False,True,2025-02-24 14:06:11.795000+00:00
Avenga,Analityk biznesowy IT,17,senior,"BPMN, Confluence, Jira, SQL, UML",,full_time,hybrid,B2B,21000.0-25200.0,False,małopolskie,Kraków,Generała Bohdana Zielińskiego,False,True,2025-02-24 14:05:12.935000+00:00
7N,Project Specialist,15,junior,"Confluence, Jira, ServiceNow",,full_time,hybrid,B2B,9240.0-11760.0,False,mazowieckie,Warszawa,Mokotów,False,True,2025-02-24 14:02:26.445000+00:00
Jit Team,Performance Test Engineer,11,senior,"Apache JMeter, JMeter",,full_time,hybrid,B2B,19000.0-21660.0,False,mazowieckie,Warszawa,,False,False,2025-02-24 14:01:49.396000+00:00
ING Hubs Poland,Senior/Expert Java Developer,6,senior,"Apache Spark, Java, Scala",,full_time,hybrid,Permanent,16000.0-25000.0,True,śląskie,Katowice,Zabrska 19,True,True,2025-02-24 14:01:49.396000+00:00
Espeo Software,Backend/Data Engineer,5,mid,"Apache Kafka, Apache Spark, Cloud, Python",,full_time,hybrid,B2B,20800.0-24000.0,False,małopolskie,Kraków,Kraków,False,False,2025-02-24 14:01:49.396000+00:00
ING Hubs Poland,Data Engineer- Oracle ODI,12,mid," Oracle Data Integrator 12c, Linux, Oracle GoldenGate, Oracle SQL, RDBMS",,full_time,hybrid,Permanent,13000.0-28000.0,True,śląskie,Katowice,Zabrska 19,True,True,2025-02-24 14:01:49.396000+00:00
ING Hubs Poland,Ops Engineer with Oracle and Linux,12,mid,"Azure DevOps, Linux, Maven, Oracle SQL, RDBMS",,full_time,hybrid,Permanent,13000.0-28000.0,True,śląskie,Katowice,Zabrska 19,True,True,2025-02-24 14:01:49.396000+00:00
DevsData LLC,React & Node.js Developer (REMOTE),1,senior,"AWS, Node.js, React",,full_time,remote,B2B,22500.0-27000.0,False,mazowieckie,Warsaw,Centrum,True,True,2025-02-24 14:01:49.396000+00:00
From Poland With Dev,JS Backend Developer | Data & Integrations | US e-commerce,1,mid,"AWS, Backend, BigQuery, E-commerce, GraphQL, JavaScript, Mixpanel, Searchspring, Segment, Shopify",,full_time,remote,B2B,23000.0-30000.0,False,małopolskie,Kraków,Czysta 10,False,True,2025-02-24 14:01:49.396000+00:00
Link Group,Senior Fullstack Developer (Angular/Java),6,senior,"Angular, CI/CD, DevOps, Java, Jest, NgRx, Oracle, PL/SQL, Spring Boot, Swagger",,full_time,hybrid,B2B,20160.0-26880.0,False,mazowieckie,Warszawa,,False,False,2025-02-24 14:01:49.396000+00:00
Neustark AG,Lead Software Architect,7,senior,".Net, AWS, Azure, Big Data, Power BI",,full_time,remote,B2B,24000.0-34000.0,False,mazowieckie,Warszawa,Warszawa,True,True,2025-02-24 14:01:49.396000+00:00
Relativity,Senior Security Engineer - Vulnerability Management,18,senior,"Azure, FedRAMP, Security, modern vulnerability scanning tools",,full_time,hybrid,Permanent,18250.0-27420.0,True,małopolskie,Kraków,,False,False,2025-02-24 14:01:49.396000+00:00
makeitright,Data Architect,19,c_level,"Apache Spark, Azure, Delta Lake, Python",,full_time,remote,B2B,33000.0-36000.0,False,mazowieckie,Warszawa,Postępu,False,False,2025-02-24 14:01:49.396000+00:00
DCV Technologies,Test manager- Control M Scheduling,24,mid,"Control M, Proficiency in English",,full_time,hybrid,B2B,19000.0-21000.0,False,małopolskie,Kraków,Krakow,False,False,2025-02-24 14:01:49.396000+00:00
Holisticon Insight,Data/DWH Engineer (Snowflake),19,senior,"AWS, DWH, ETL tools, Power BI, SQL",,full_time,remote,B2B,23000.0-25700.0,False,dolnośląskie,Wrocław,Fabryczna 6,True,True,2025-02-24 14:01:49.396000+00:00
Apollo.io,Engineering Manager,4,senior,"AI, Databricks, Elasticsearch, MongoDB, Project Management, Python, React, Ruby, SQL, Snowflake",,full_time,remote,Permanent,30000.0-52000.0,True,mazowieckie,Warszawa,,False,False,2025-02-24 14:01:49.396000+00:00
Apollo.io,Engineering Manager,15,senior,"AI, Databricks, Elasticsearch, MongoDB, Project Management, Python, React, Ruby, SQL, Snowflake",,full_time,remote,Permanent,30000.0-52000.0,True,mazowieckie,Warszawa,,False,False,2025-02-24 14:01:49.396000+00:00
Jakdojade (City-nav Sp. z o.o.),Java/Kotlin Developer,6,mid,"Java, Kotlin",,full_time,remote,B2B,11000.0-20000.0,False,wielkopolskie,Poznań,Grunwaldzka 43,False,True,2025-02-24 14:01:49.396000+00:00
Enxoo,Junior Salesforce Developer,24,junior,"Apex, Java, Salesforce",,full_time,hybrid,Any,5000.0-11000.0,True,mazowieckie,Warszawa,Al. Jerozolimskie 123A,False,False,2025-02-24 14:01:49.396000+00:00
emagine Polska,Citrix and Ivanti Engineer,13,senior,"Citrix, Microsoft Active Directory, Powershell, ivanti",,full_time,hybrid,B2B,21840.0-25200.0,False,pomorskie,Gdańsk,Aleja Grunwaldzka,False,False,2025-02-24 14:01:49.396000+00:00
Link Group,Tech Operations/Automation Specialist with Terraform,12,mid,"CI/CD, Git, Okta, Terraform, Workato",,full_time,hybrid,B2B,25000.0-32000.0,False,mazowieckie,Warszawa,,False,False,2025-02-24 14:01:49.396000+00:00
Link Group,Automation Developer with NICE,24,mid,"MS Office, NICE APA, RPA, SAP, automation",,full_time,remote,B2B,17640.0-21000.0,False,mazowieckie,Warszawa,,False,False,2025-02-24 14:01:49.396000+00:00
Pragmile,Senior .Net Engineer Remote,7,senior,".NET Core, Azure, Clean Code, DDD, Docker, Microservices, NoSQL, REST, SQL, TDD",,full_time,remote,B2B,25000.0-30240.0,False,mazowieckie,Warszawa,al. Jerozolimskie 92,True,True,2025-02-24 14:01:49.396000+00:00
ArdentCode,Python Developer,5,mid,"Falcon, Gunicorn, MongoDB, Python, RabbitMQ",,full_time,remote,B2B,15000.0-18000.0,False,dolnośląskie,Wrocław,Jeździecka 19,False,True,2025-02-24 14:01:49.396000+00:00
XTrack Sp. z o.o.,Senior Fullstack Developer,6,senior,"Azure, Go, Java, Microservices, MongoDB, React, Redux, SQL, Testing, TypeScript",,full_time,remote,B2B,24000.0-32000.0,False,pomorskie,Gdańsk,Piastowska 63A,False,True,2025-02-24 14:01:49.396000+00:00
Momentum,IT Business Analyst (Sales & Discovery),17,mid,"Business Analysis, English",,full_time,remote,B2B,13000.0-17000.0,False,dolnośląskie,Wrocław,Gen. Władysława Sikorskiego 26,False,True,2025-02-24 14:01:49.396000+00:00
Siepomaga.pl,React Native Developer,1,mid,"Expo, JavaScript, React Native, Unit Testing",,full_time,remote,B2B,12000.0-18000.0,False,wielkopolskie,Poznań,pl. Władysława Andersa 3,False,True,2025-02-24 14:01:49.396000+00:00
emagine Polska,"Data Engineer (Python, Databricks)",19,mid,"Azure Databricks, CI/CD, PySpark, Python",,full_time,remote,B2B,26800.0-31000.0,False,mazowieckie,Warszawa,Domaniewska 39,False,True,2025-02-24 14:01:49.396000+00:00
Kongsberg Maritime Poland Sp. z  o.o.,Software Architect,23,senior,"C#, C++, Software Architecture",,full_time,hybrid,Permanent,20000.0-24000.0,True,zachodniopomorskie,Szczecin,1 Maja 38,True,False,2025-02-24 14:01:49.396000+00:00
SoftKraft,Django Web Developer,5,mid,"Celery, Django, English, Git, Python, REST API",,full_time,remote,B2B,13440.0-17640.0,False,śląskie,Bielsko-Biała,Powstańców Śląskich 3,False,True,2025-02-24 14:01:12.146000+00:00
7N,Scrum Master,15,senior,"Azure DevOps, Scrum Master",,full_time,remote,B2B,25200.0-30240.0,False,mazowieckie,Warszawa,Krakowiaków 46,False,True,2025-02-24 14:00:28.363000+00:00
Antal Sp. z o.o.,Business Analyst,17,mid,Business Analysis,,full_time,hybrid,B2B,120.0-170.0,False,małopolskie,Kraków,centrum,False,False,2025-02-24 13:44:21.438000+00:00
P&P Solutions,Senior Backend Developer (Java),6,senior,"Docker, Hibernate, Java, Kubernetes, Spring",,full_time,remote,B2B,22000.0-25200.0,False,mazowieckie,Warszawa,Warszawa,False,True,2025-02-24 13:37:41.809000+00:00
emagine Polska,Test Automation Engineer (Python+Robot Framework),11,senior,"BDD, CI/CD, Git, Linux, Microservices, Python, REST API, SQL",,full_time,hybrid,B2B,26880.0-26880.0,False,mazowieckie,Warszawa,,False,False,2025-02-24 13:27:54.937000+00:00
emagine Polska,DevOps Engineer,12,senior,"Ansible, Bitbucket, CI/CD, DevOps, Git, Groovy, Kubernetes, Python",,full_time,hybrid,B2B,29400.0-29400.0,False,mazowieckie,Warszawa,,False,False,2025-02-24 13:25:30.285000+00:00
emagine Polska,Azure DevOps/Platform  Engineer,12,mid,"Amazon AWS, Azure DevOps, Go, JavaScript, Microsoft Azure, Python",,full_time,remote,B2B,25200.0-27720.0,False,łódzkie,Poland (Remote),.,False,True,2025-02-24 13:08:14.670000+00:00
Primaris,IT Senior Business Analyst,17,senior,"FX products, Murex, flex",,full_time,hybrid,B2B,25200.0-28560.0,False,mazowieckie,Warszawa,Bukowińska 22B,False,True,2025-02-24 13:03:48.029000+00:00
ING Bank Śląski,Senior DevOps Engineer - Tribe Aplikacji Biznesowych,12,senior,"Active Directory, Ansible, Azure DevOps, Bash, Google Cloud, Linux, Oracle, PostgreSQL, Powershell, Windows",,full_time,hybrid,Permanent,15000.0-22000.0,True,mazowieckie,Warszawa,Puławska 2,False,True,2025-02-24 13:00:32.952000+00:00
Consdata S.A.,Regular Fullstack Developer (Java + Angular),6,mid,"Angular, Docker, Git, IntelliJ, Java, MongoDB, OpenShift, PostgreSQL, Spring, TypeScript",,full_time,remote,B2B,14950.0-21000.0,False,wielkopolskie,Poznań,"K9Office, Krysiewicza 9/14",False,True,2025-02-24 13:00:32.952000+00:00
Consdata S.A.,Senior Fullstack Developer (Java + Angular),6,senior,"Angular, Docker, Git, IntelliJ, Java, MongoDB, OpenShift, PostgreSQL, Spring, TypeScript",,full_time,remote,B2B,19680.0-27220.0,False,wielkopolskie,Poznań,"K9Office, Krysiewicza 9/14",False,True,2025-02-24 13:00:32.952000+00:00
H2B Group,Dynamics 365 F&O Developer,22,senior,"English, Microsoft Dynamics 365",,freelance,remote,B2B,28800.0-32800.0,False,pomorskie,Gdańsk,Abrahama 1A,False,False,2025-02-24 13:00:32.952000+00:00
Techmo,Machine Learning Engineer,19,mid,"Docker, GitLab, Machine Learning, PyTorch, Python 3.x, SpeechBrain",,full_time,hybrid,Permanent,10500.0-20000.0,True,małopolskie,Kraków,Torfowa 1,False,False,2025-02-24 13:00:32.952000+00:00
Amsterdam Standard,Full-Stack Developer,1,mid,"API, MySQL, PHP, React, Redux, Symfony, TypeScript",,full_time,remote,B2B,14000.0-19000.0,False,małopolskie,Kraków,Generała Bohdana Zielińskiego 22,False,True,2025-02-24 13:00:32.952000+00:00
makeitright,Senior Data Engineer,19,senior,"Azure, CI/CD, Kubernetes/AKS, Python, SQL, Senior Data Engineer, •	Azure Data Stack",,full_time,remote,B2B,26000.0-30000.0,False,mazowieckie,Warszawa,Postępu,False,False,2025-02-24 13:00:32.952000+00:00
Synerise,Senior ML Engineer,5,senior,"Java, Kafka, Python, Rust, Scala",,full_time,remote,B2B,20000.0-27000.0,False,małopolskie,Kraków,Zabłocie 43B,False,False,2025-02-24 13:00:32.952000+00:00
ASPER BROTHERS,React/React Native,1,mid,"EXPO/EAS, GitHub, React, React Native, Supabase, vercel",,full_time,remote,B2B,10000.0-15000.0,False,mazowieckie,Warszawa,al. „Solidarności” 119/125,False,True,2025-02-24 13:00:32.952000+00:00
Yard Corporate,PHP Tech Lead,3,senior,"PHP, PostgreSQL, React, SQL",,full_time,office,B2B,35000.0-45000.0,False,mazowieckie,Warszawa,warsaw,False,True,2025-02-24 13:00:32.952000+00:00
Rawlplug,Backend/FullStack Developer (PHP/JS),12,mid,"Docker, Elasticsearch, Git, GraphQL, MySQL, Node.js, PHP, Postman, Solid, Symfony",,full_time,hybrid,B2B,18000.0-20000.0,False,dolnośląskie,Wrocław,Kwidzyńska 6,False,False,2025-02-24 13:00:32.952000+00:00
Yard Corporate,Senior .NET Engineer,7,senior,"ASP.NET, Angular, Azure, C#, Docker, MS SQL, TypeScript",,full_time,hybrid,B2B,30000.0-40000.0,False,mazowieckie,Warszawa,Warszawa,False,True,2025-02-24 13:00:32.952000+00:00
Jit Team,Test Automation Engineer (.NET),11,senior,".NET C#, API Testing, Agile, Automated Testing, GUI, Relational Databases",,full_time,hybrid,B2B,15200.0-22000.0,False,mazowieckie,Warszawa,,False,False,2025-02-24 13:00:32.952000+00:00
DAC.digital,IT System Administrator / Web Developer with German 💼,13,senior,"CI/CD, Docker, German, MS Dynamics, TYPO3",,full_time,remote,B2B,20000.0-24000.0,False,pomorskie,Gdańsk,,True,True,2025-02-24 13:00:32.952000+00:00
Pragmile,Senior Data Engineer,19,senior,"Git, PySpark, Python, SQL, Terraform",,full_time,hybrid,B2B,27720.0-32760.0,False,mazowieckie,Warszawa,Prosta 20,True,True,2025-02-24 13:00:32.952000+00:00
Voucherify,Technical Account Manager,24,mid,"Business Analysis, E-commerce, English, JavaScript, Microservices, SaaS, Testing, User Stories",,full_time,remote,Permanent,18000.0-22000.0,True,śląskie,Katowice,Porcelanowa 23,False,True,2025-02-24 13:00:32.952000+00:00
Jit Team,Database Backup Administrator,19,senior,"English, MS SQL, MS SQL Server, SQL Server",,full_time,hybrid,B2B,16800.0-20160.0,False,pomorskie,Gdynia,Łużycka,False,False,2025-02-24 13:00:32.952000+00:00
Flying Bisons,Angular Developer,1,mid,"Angular, RxJS, TypeScript",,full_time,remote,B2B,11000.0-15000.0,False,mazowieckie,Warszawa,Prosta 20,False,True,2025-02-24 13:00:32.952000+00:00
Link Group,Mid Angular Developer,1,mid,"Angular, RESTful API, TypeScript",,full_time,remote,B2B,8400.0-13440.0,False,mazowieckie,Warszawa,,False,True,2025-02-24 13:00:32.952000+00:00
7N,Senior Security Specialist,18,senior,"Detection Engineering, IT Security, Threat hunting",,full_time,hybrid,B2B,33600.0-42000.0,False,mazowieckie,Warszawa,Centrum,False,True,2025-02-24 13:00:32.952000+00:00
Tesco Technology,Software Engineer - Early Careers,24,junior,"Agile, Analytical Thinking, Azure, Java, JavaScript, Microservices",,full_time,hybrid,Permanent,10700.0-10700.0,True,małopolskie,Kraków,Przy Rondzie 4,True,True,2025-02-24 13:00:32.952000+00:00
Xebia,Senior Node.js Developer with Auth0,1,senior,"AWS, Auth0, JavaScript, Node.js",,full_time,remote,B2B,18500.0-24500.0,False,dolnośląskie,Wrocław,Sucha 3,False,False,2025-02-24 13:00:32.952000+00:00
Espeo Software,Technical Team Leader,6,senior,"AWS, Clojure, Java, Kafka, PostgreSQL, SQS",,full_time,hybrid,B2B,27200.0-40000.0,False,małopolskie,Kraków,Kraków,False,False,2025-02-24 13:00:32.952000+00:00
DEVTALENTS Sp. z o.o.,Senior Full Stack Developer,1,senior,"AWS, JavaScript, Next.js, NoSQL, Node.js, React Native, React.JS, TypeScript, Webpack",,full_time,hybrid,B2B,25000.0-32000.0,False,mazowieckie,Warszawa,Mazowiecka 11,False,True,2025-02-24 13:00:32.952000+00:00
PeopleTrust Sp. z o.o.,QA - 100% remote,11,mid,"Git, Java, Jenkins, Maven, OOP, Selenium",,full_time,remote,B2B,17200.0-20540.0,False,mazowieckie,Warszawa,Aleja Armii Ludowej 26,False,True,2025-02-24 12:48:13.126000+00:00
Univio,Machine Learning Engineer,25,mid,"AWS, Computer Vision, Databases, Docker, Kubernetes, LLM, MLOps, NLP, OpenAI, Python",,full_time,remote,B2B,18500.0-22700.0,False,małopolskie,Kraków,AK 25,False,True,2025-02-24 12:31:25.400000+00:00
Accelerated.Finance,Quantitative Developer - Cryptocurrency Trading,24,senior,"CCXT, Computer science, Cryptocurrencies, Mathematics, Rust, finance",,full_time,remote,B2B,19780.0-59320.0,False,mazowieckie,Warszawa,,False,True,2025-02-24 12:10:25.001000+00:00
H2B Group,Python Developer,5,mid,"AWS, Django, Python",,full_time,remote,B2B,17600.0-19200.0,False,pomorskie,Gdańsk,Abrahama 1A,False,False,2025-02-24 12:05:50.928000+00:00
Spyrosoft,Wrocław: Project Manager [Media],15,mid,"English C1, Jira, Polish C1, Scrum",,full_time,hybrid,B2B,16800.0-23500.0,False,dolnośląskie,Wrocław,plac Nowy Targ 28,False,False,2025-02-24 12:01:22.111000+00:00
Kevin Edward,Kotlin Developer/DevOps,10,senior,"AWS, Android, DevOps, JVM, Jenkins, Kotlin",,full_time,remote,B2B,20000.0-28000.0,False,małopolskie,Kraków,Central Krakow,True,True,2025-02-24 12:01:22.111000+00:00
